<?xml version="1.0" encoding="UTF-8"?> 

<player xmlns:xsi="http://www.w3.org/2001/XMLSchema-instance" 
    xsi:noNamespaceSchemaLocation="player.xsd"> 
   <team_id>1568</team_id> 
   <id>108526</id> 
   <name>نيكولا راكوجيفتش</name> 
   <image>https://secure.cache.images.core.optasports.com/soccer/players/150x150/108526.png</image> 
   <position>مونتينيغرو</position> 
   <nationality>1958-01-15</nationality> 
   <birth-day>مونتينيغرو</birth-day> 
   <length  unit="cm"></length> 
   <weight  unit="kg"></weight> 
</player>