<?xml version="1.0" encoding="UTF-8"?> 

<player xmlns:xsi="http://www.w3.org/2001/XMLSchema-instance" 
    xsi:noNamespaceSchemaLocation="player.xsd"> 
   <team_id>601</team_id> 
   <id>566867</id> 
   <name>J. Lindstrøm</name> 
   <image>https://secure.cache.images.core.optasports.com/soccer/players/150x150/566867.png</image> 
   <position>لاعب وسط</position> 
   <nationality>الدنمارك</nationality> 
   <birth-day>2000-02-29</birth-day> 
   <length  unit="cm">181</length> 
   <weight  unit="kg">63</weight> 
</player>