<?xml version="1.0" encoding="UTF-8"?> 

<player xmlns:xsi="http://www.w3.org/2001/XMLSchema-instance" 
    xsi:noNamespaceSchemaLocation="player.xsd"> 
   <team_id>10610</team_id> 
   <id>509305</id> 
   <name>N. Sergeev</name> 
   <image>https://secure.cache.images.core.optasports.com/soccer/players/150x150/509305.png</image> 
   <position>مهاجم</position> 
   <nationality>روسيا</nationality> 
   <birth-day>1999-10-17</birth-day> 
   <length  unit="cm">روسيا</length> 
   <weight  unit="kg">176</weight> 
</player>