<?xml version="1.0" encoding="UTF-8"?> 

<player xmlns:xsi="http://www.w3.org/2001/XMLSchema-instance" 
    xsi:noNamespaceSchemaLocation="player.xsd"> 
   <team_id>5026</team_id> 
   <id>642328</id> 
   <name>Y. Saidi</name> 
   <image>https://secure.cache.images.core.optasports.com/soccer/players/150x150/642328.png</image> 
   <position>حارس مرمى</position> 
   <nationality>تونس</nationality> 
   <birth-day>1998-01-08</birth-day> 
   <length  unit="cm"></length> 
   <weight  unit="kg"></weight> 
</player>