<?xml version="1.0" encoding="UTF-8"?> 

<player xmlns:xsi="http://www.w3.org/2001/XMLSchema-instance" 
    xsi:noNamespaceSchemaLocation="player.xsd"> 
   <team_id>22136</team_id> 
   <id>588788</id> 
   <name>Y. Fertout</name> 
   <image>https://secure.cache.images.core.optasports.com/soccer/players/150x150/588788.png</image> 
   <position>غير معروف</position> 
   <nationality>المغرب</nationality> 
   <birth-day>1970-07-07</birth-day> 
   <length  unit="cm"></length> 
   <weight  unit="kg"></weight> 
</player>