<?xml version="1.0" encoding="UTF-8"?> 

<player xmlns:xsi="http://www.w3.org/2001/XMLSchema-instance" 
    xsi:noNamespaceSchemaLocation="player.xsd"> 
   <team_id>2331</team_id> 
   <id>644818</id> 
   <name>L. Garrett</name> 
   <image>https://secure.cache.images.core.optasports.com/soccer/players/150x150/644818.png</image> 
   <position>مدافع</position> 
   <nationality>ويلز</nationality> 
   <birth-day>ويلز</birth-day> 
   <length  unit="cm"></length> 
   <weight  unit="kg"></weight> 
</player>