<?xml version="1.0" encoding="UTF-8"?> 

<player xmlns:xsi="http://www.w3.org/2001/XMLSchema-instance" 
    xsi:noNamespaceSchemaLocation="player.xsd"> 
   <team_id>12387</team_id> 
   <id>509013</id> 
   <name>V. Naydenov</name> 
   <image>https://secure.cache.images.core.optasports.com/soccer/players/150x150/509013.png</image> 
   <position>مهاجم</position> 
   <nationality>بلغاريا</nationality> 
   <birth-day>2001-11-29</birth-day> 
   <length  unit="cm"></length> 
   <weight  unit="kg"></weight> 
</player>