<?xml version="1.0" encoding="UTF-8"?> 

<player xmlns:xsi="http://www.w3.org/2001/XMLSchema-instance" 
    xsi:noNamespaceSchemaLocation="player.xsd"> 
   <team_id>5555</team_id> 
   <id>634192</id> 
   <name>S. Barrouhou</name> 
   <image>https://secure.cache.images.core.optasports.com/soccer/players/150x150/634192.png</image> 
   <position>حارس مرمى</position> 
   <nationality>المغرب</nationality> 
   <birth-day>1994-01-18</birth-day> 
   <length  unit="cm">191</length> 
   <weight  unit="kg">78</weight> 
</player>