<?xml version="1.0" encoding="UTF-8"?> 

<player xmlns:xsi="http://www.w3.org/2001/XMLSchema-instance" 
    xsi:noNamespaceSchemaLocation="player.xsd"> 
   <team_id>1184</team_id> 
   <id>637968</id> 
   <name>D. Bogdanov</name> 
   <image>https://secure.cache.images.core.optasports.com/soccer/players/150x150/637968.png</image> 
   <position>مهاجم</position> 
   <nationality>أيرلندا</nationality> 
   <birth-day>أيرلندا</birth-day> 
   <length  unit="cm"></length> 
   <weight  unit="kg"></weight> 
</player>