<?xml version="1.0" encoding="UTF-8"?> 

<player xmlns:xsi="http://www.w3.org/2001/XMLSchema-instance" 
    xsi:noNamespaceSchemaLocation="player.xsd"> 
   <team_id>1245</team_id> 
   <id>612615</id> 
   <name>A. Bianchi</name> 
   <image>https://secure.cache.images.core.optasports.com/soccer/players/150x150/612615.png</image> 
   <position>لاعب وسط</position> 
   <nationality>إيطاليا</nationality> 
   <birth-day>2000-10-02</birth-day> 
   <length  unit="cm"></length> 
   <weight  unit="kg"></weight> 
</player>