<?xml version="1.0" encoding="UTF-8"?> 

<player xmlns:xsi="http://www.w3.org/2001/XMLSchema-instance" 
    xsi:noNamespaceSchemaLocation="player.xsd"> 
   <team_id>11710</team_id> 
   <id>373521</id> 
   <name>إيجور تشيريفشينكو</name> 
   <image>https://secure.cache.images.core.optasports.com/soccer/players/150x150/373521.png</image> 
   <position>مدافع</position> 
   <nationality>طاجكستان</nationality> 
   <birth-day>1974-08-21</birth-day> 
   <length  unit="cm">طاجكستان</length> 
   <weight  unit="kg">178</weight> 
</player>