<?xml version="1.0" encoding="UTF-8"?> 

<player xmlns:xsi="http://www.w3.org/2001/XMLSchema-instance" 
    xsi:noNamespaceSchemaLocation="player.xsd"> 
   <team_id>6676</team_id> 
   <id>555189</id> 
   <name>A. Kouadio</name> 
   <image>https://secure.cache.images.core.optasports.com/soccer/players/150x150/555189.png</image> 
   <position>مهاجم</position> 
   <nationality>ساحل العاج</nationality> 
   <birth-day>1996-05-19</birth-day> 
   <length  unit="cm"></length> 
   <weight  unit="kg"></weight> 
</player>