<?xml version="1.0" encoding="UTF-8"?> 

<player xmlns:xsi="http://www.w3.org/2001/XMLSchema-instance" 
    xsi:noNamespaceSchemaLocation="player.xsd"> 
   <team_id>778</team_id> 
   <id>451913</id> 
   <name>J. Hauksson</name> 
   <image>https://secure.cache.images.core.optasports.com/soccer/players/150x150/451913.png</image> 
   <position>غير معروف</position> 
   <nationality>أيسلندا</nationality> 
   <birth-day>أيسلندا</birth-day> 
   <length  unit="cm"></length> 
   <weight  unit="kg"></weight> 
</player>