<?xml version="1.0" encoding="UTF-8"?> 

<player xmlns:xsi="http://www.w3.org/2001/XMLSchema-instance" 
    xsi:noNamespaceSchemaLocation="player.xsd"> 
   <team_id>3231</team_id> 
   <id>616493</id> 
   <name>A. Ćatović</name> 
   <image>https://secure.cache.images.core.optasports.com/soccer/players/150x150/616493.png</image> 
   <position>مدافع</position> 
   <nationality>مونتينيغرو</nationality> 
   <birth-day>2001-06-10</birth-day> 
   <length  unit="cm"></length> 
   <weight  unit="kg"></weight> 
</player>