<?xml version="1.0" encoding="UTF-8"?> 

<player xmlns:xsi="http://www.w3.org/2001/XMLSchema-instance" 
    xsi:noNamespaceSchemaLocation="player.xsd"> 
   <team_id>1205</team_id> 
   <id>441519</id> 
   <name>E. Zeka</name> 
   <image>https://secure.cache.images.core.optasports.com/soccer/players/150x150/441519.png</image> 
   <position>ألبانيا</position> 
   <nationality>Shkodër</nationality> 
   <birth-day>ألبانيا</birth-day> 
   <length  unit="cm"></length> 
   <weight  unit="kg"></weight> 
</player>