<?xml version="1.0" encoding="UTF-8"?> 

<player xmlns:xsi="http://www.w3.org/2001/XMLSchema-instance" 
    xsi:noNamespaceSchemaLocation="player.xsd"> 
   <team_id>703</team_id> 
   <id>164995</id> 
   <name>خابيير غراسيا</name> 
   <image>https://secure.cache.images.core.optasports.com/soccer/players/150x150/164995.png</image> 
   <position>إسبانيا</position> 
   <nationality>1970-05-01</nationality> 
   <birth-day>Pamplona</birth-day> 
   <length  unit="cm"></length> 
   <weight  unit="kg"></weight> 
</player>