<?xml version="1.0" encoding="UTF-8"?> 

<player xmlns:xsi="http://www.w3.org/2001/XMLSchema-instance" 
    xsi:noNamespaceSchemaLocation="player.xsd"> 
   <team_id>1250</team_id> 
   <id>212683</id> 
   <name>رولاندو ماران</name> 
   <image>https://secure.cache.images.core.optasports.com/soccer/players/150x150/212683.png</image> 
   <position>غير معروف</position> 
   <nationality>إيطاليا</nationality> 
   <birth-day>1963-07-14</birth-day> 
   <length  unit="cm">إيطاليا</length> 
   <weight  unit="kg"></weight> 
</player>