<?xml version="1.0" encoding="UTF-8"?> 

<player xmlns:xsi="http://www.w3.org/2001/XMLSchema-instance" 
    xsi:noNamespaceSchemaLocation="player.xsd"> 
   <team_id>11710</team_id> 
   <id>503328</id> 
   <name>M. Barman</name> 
   <image>https://secure.cache.images.core.optasports.com/soccer/players/150x150/503328.png</image> 
   <position>مهاجم</position> 
   <nationality>تركيا</nationality> 
   <birth-day>2000-05-28</birth-day> 
   <length  unit="cm">تركيا</length> 
   <weight  unit="kg"></weight> 
</player>