<?xml version="1.0" encoding="UTF-8"?> 

<player xmlns:xsi="http://www.w3.org/2001/XMLSchema-instance" 
    xsi:noNamespaceSchemaLocation="player.xsd"> 
   <team_id>178</team_id> 
   <id>605708</id> 
   <name>O. Starynskyi</name> 
   <image>https://secure.cache.images.core.optasports.com/soccer/players/150x150/605708.png</image> 
   <position>غير معروف</position> 
   <nationality>أوكرانيا</nationality> 
   <birth-day>1985-11-28</birth-day> 
   <length  unit="cm">أوكرانيا</length> 
   <weight  unit="kg"></weight> 
</player>