<?xml version="1.0" encoding="UTF-8"?> 

<player xmlns:xsi="http://www.w3.org/2001/XMLSchema-instance" 
    xsi:noNamespaceSchemaLocation="player.xsd"> 
   <team_id>207</team_id> 
   <id>464122</id> 
   <name>م. نغوم</name> 
   <image>https://secure.cache.images.core.optasports.com/soccer/players/150x150/464122.png</image> 
   <position>لاعب وسط</position> 
   <nationality>بلاروسيا</nationality> 
   <birth-day>1999-08-26</birth-day> 
   <length  unit="cm">بلاروسيا</length> 
   <weight  unit="kg"></weight> 
</player>