<?xml version="1.0" encoding="UTF-8"?> 

<player xmlns:xsi="http://www.w3.org/2001/XMLSchema-instance" 
    xsi:noNamespaceSchemaLocation="player.xsd"> 
   <team_id>327</team_id> 
   <id>601262</id> 
   <name>Diguinho</name> 
   <image>https://secure.cache.images.core.optasports.com/soccer/players/150x150/601262.png</image> 
   <position>مدافع</position> 
   <nationality>البرازيل</nationality> 
   <birth-day>2001-05-26</birth-day> 
   <length  unit="cm">البرازيل</length> 
   <weight  unit="kg"></weight> 
</player>